{
  "$schema": "https://json-schema.org/draft/2020-12/schema",
  "title": "Mentální otočka ve sportu",
  "type": "object",
  "required": [
    "id",
    "sport",
    "date",
    "event",
    "protagonist",
    "deficit",
    "result",
    "turning_point",
    "mental_mechanism",
    "story",
    "evidence",
    "video",
    "sources",
    "verified_at"
  ],
  "additionalProperties": false,
  "properties": {
    "id": {
      "type": "string",
      "pattern": "^[a-z0-9]+(-[a-z0-9]+)*$",
      "description": "rok-soutez-protagonista, bez diakritiky"
    },
    "sport": {
      "type": "string",
      "enum": [
        "tenis",
        "fotbal",
        "hokej",
        "mma",
        "golf",
        "atletika",
        "basketbal",
        "box",
        "cyklistika",
        "f1",
        "ostatni"
      ]
    },
    "date": {
      "type": "string",
      "format": "date"
    },
    "event": {
      "type": "string",
      "description": "Soutěž a ročník"
    },
    "stage": {
      "type": "string",
      "description": "Fáze — finále, semifinále, 1. kolo…"
    },
    "protagonist": {
      "type": "string"
    },
    "opponent": {
      "type": "string"
    },
    "deficit": {
      "type": "string",
      "description": "Z jakého stavu se otáčelo — konkrétně"
    },
    "result": {
      "type": "string",
      "description": "Konečný výsledek"
    },
    "turning_point": {
      "type": "string",
      "description": "Konkrétní okamžik zlomu"
    },
    "mental_mechanism": {
      "type": "array",
      "minItems": 1,
      "items": {
        "type": "string"
      },
      "description": "Tagy ze slovníku v SKILL.md"
    },
    "story": {
      "type": "string",
      "description": "3–6 vět česky: co se stalo a co se změnilo v hlavě"
    },
    "uncertainty": {
      "type": "string",
      "description": "Co není jisté nebo doložené"
    },
    "caveat": {
      "type": "string",
      "description": "Kontroverze, doping, pozdější zpochybnění"
    },
    "evidence": {
      "type": "object",
      "required": [
        "asked_about",
        "athlete_quotes"
      ],
      "additionalProperties": false,
      "properties": {
        "asked_about": {
          "type": "boolean",
          "description": "Byl na mentální stránku přímo tázán? (podmínka 3)"
        },
        "athlete_quotes": {
          "type": "array",
          "minItems": 1,
          "items": {
            "$ref": "#/$defs/quote"
          }
        },
        "expert_quotes": {
          "type": "array",
          "items": {
            "$ref": "#/$defs/quote"
          }
        }
      }
    },
    "video": {
      "type": "array",
      "minItems": 1,
      "items": {
        "type": "object",
        "required": [
          "label",
          "url",
          "type"
        ],
        "additionalProperties": false,
        "properties": {
          "label": {
            "type": "string"
          },
          "url": {
            "type": "string",
            "format": "uri"
          },
          "type": {
            "type": "string",
            "enum": [
              "key_moment",
              "highlights",
              "full_match",
              "press_conference",
              "interview",
              "documentary",
              "search"
            ]
          }
        }
      }
    },
    "sources": {
      "type": "array",
      "minItems": 1,
      "items": {
        "type": "object",
        "required": [
          "name",
          "url"
        ],
        "additionalProperties": false,
        "properties": {
          "name": {
            "type": "string"
          },
          "url": {
            "type": "string",
            "format": "uri"
          }
        }
      }
    },
    "verified_at": {
      "type": "string",
      "format": "date"
    },
    "concept": {
      "type": "object",
      "description": "Produkční koncept pro krátké video (Instagram Reels, 9:16)",
      "required": [
        "hook",
        "logline",
        "duration_s",
        "beats",
        "payoff",
        "caption",
        "hashtags",
        "closing",
        "credits",
        "title_card"
      ],
      "additionalProperties": false,
      "properties": {
        "hook": {
          "type": "string",
          "description": "První 1–2 vteřiny — co zastaví palec"
        },
        "logline": {
          "type": "string",
          "description": "O čem to je, jedna věta"
        },
        "duration_s": {
          "type": "integer",
          "minimum": 15,
          "maximum": 90
        },
        "beats": {
          "type": "array",
          "minItems": 4,
          "items": {
            "type": "object",
            "required": [
              "t",
              "beat",
              "visual",
              "overlay"
            ],
            "additionalProperties": false,
            "properties": {
              "t": {
                "type": "string",
                "description": "Časové okno, např. 0:12–0:20"
              },
              "beat": {
                "type": "string",
                "enum": [
                  "Konec",
                  "Kontext",
                  "Zlom",
                  "Obrat",
                  "Důkaz",
                  "Pointa"
                ]
              },
              "visual": {
                "type": "string",
                "description": "Co je na obraze a odkud se to bere"
              },
              "overlay": {
                "type": "string",
                "description": "Text na obrazovce — krátký"
              }
            }
          }
        },
        "payoff": {
          "type": "object",
          "required": [
            "speaker",
            "line"
          ],
          "additionalProperties": false,
          "properties": {
            "speaker": {
              "type": "string"
            },
            "line": {
              "type": "string",
              "description": "Citace zkrácená pro titulek — musí odpovídat doložené citaci"
            }
          }
        },
        "caption": {
          "type": "string",
          "description": "Text pod příspěvek"
        },
        "hashtags": {
          "type": "array",
          "minItems": 3,
          "items": {
            "type": "string",
            "pattern": "^#"
          }
        },
        "audio": {
          "type": "string",
          "description": "Doporučení ke zvuku"
        },
        "closing": {
          "type": "string",
          "description": "Poslední věta na obraze"
        },
        "credits": {
          "type": "object",
          "description": "Kdo drží práva ke každému použitému materiálu a jak se to uvede",
          "required": [
            "on_screen",
            "caption_block",
            "clips",
            "risk"
          ],
          "additionalProperties": false,
          "properties": {
            "on_screen": {
              "type": "string",
              "description": "Kredit vysázený do videa — krátký"
            },
            "caption_block": {
              "type": "string",
              "description": "Blok zdrojů, který se připojí pod caption"
            },
            "clips": {
              "type": "array",
              "minItems": 1,
              "items": {
                "type": "object",
                "required": [
                  "use",
                  "rights_holder",
                  "licence"
                ],
                "additionalProperties": false,
                "properties": {
                  "use": {
                    "type": "string",
                    "description": "Ve kterém beatu a k čemu"
                  },
                  "rights_holder": {
                    "type": "string"
                  },
                  "licence": {
                    "type": "string",
                    "enum": [
                      "all_rights_reserved",
                      "cc_by",
                      "cc_by_sa",
                      "public_domain",
                      "licensed_stock",
                      "own_material",
                      "unknown"
                    ]
                  },
                  "url": {
                    "type": "string",
                    "format": "uri"
                  },
                  "attribution": {
                    "type": "string",
                    "description": "Přesné znění, které licence vyžaduje"
                  }
                }
              }
            },
            "risk": {
              "type": "string",
              "enum": [
                "low",
                "medium",
                "high"
              ],
              "description": "Riziko stažení příspěvku nebo nároku"
            },
            "risk_note": {
              "type": "string"
            }
          }
        },
        "variant_safe": {
          "type": "object",
          "description": "Alternativní střih bez cizích archivních záběrů — nulové riziko nároku",
          "required": [
            "premise",
            "beats",
            "assets"
          ],
          "additionalProperties": false,
          "properties": {
            "premise": {
              "type": "string",
              "description": "Na čem varianta stojí místo archivu"
            },
            "beats": {
              "type": "array",
              "minItems": 4,
              "items": {
                "type": "object",
                "required": [
                  "t",
                  "beat",
                  "visual",
                  "overlay"
                ],
                "additionalProperties": false,
                "properties": {
                  "t": {
                    "type": "string",
                    "description": "Časové okno, např. 0:12–0:20"
                  },
                  "beat": {
                    "type": "string",
                    "enum": [
                      "Konec",
                      "Kontext",
                      "Zlom",
                      "Obrat",
                      "Důkaz",
                      "Pointa"
                    ]
                  },
                  "visual": {
                    "type": "string",
                    "description": "Co je na obraze a odkud se to bere"
                  },
                  "overlay": {
                    "type": "string",
                    "description": "Text na obrazovce — krátký"
                  }
                }
              }
            },
            "assets": {
              "type": "array",
              "minItems": 1,
              "items": {
                "type": "object",
                "required": [
                  "what",
                  "source",
                  "licence"
                ],
                "additionalProperties": false,
                "properties": {
                  "what": {
                    "type": "string"
                  },
                  "source": {
                    "type": "string"
                  },
                  "licence": {
                    "type": "string",
                    "enum": [
                      "all_rights_reserved",
                      "cc_by",
                      "cc_by_sa",
                      "public_domain",
                      "licensed_stock",
                      "own_material",
                      "unknown"
                    ]
                  },
                  "url": {
                    "type": "string",
                    "format": "uri"
                  },
                  "attribution": {
                    "type": "string"
                  }
                }
              }
            }
          }
        },
        "title_card": {
          "type": "object",
          "description": "Nápis vysázený do prvního záběru — rozhoduje o tom, jestli divák zůstane",
          "required": [
            "eyebrow",
            "headline",
            "basis"
          ],
          "additionalProperties": false,
          "properties": {
            "eyebrow": {
              "type": "string",
              "description": "Soutěž a fáze, malým písmem nad nadpisem"
            },
            "headline": {
              "type": "string",
              "description": "Hlavní nápis — musí se přečíst do 1,5 s"
            },
            "subline": {
              "type": "string",
              "description": "Druhý řádek, drží napětí"
            },
            "basis": {
              "type": "string",
              "enum": [
                "fakt",
                "tvrzeni"
              ],
              "description": "Je nápis ověřitelný fakt, nebo hodnotící tvrzení?"
            },
            "basis_note": {
              "type": "string",
              "description": "Čím je nápis podložený"
            }
          }
        }
      }
    }
  },
  "$defs": {
    "quote": {
      "type": "object",
      "required": [
        "speaker",
        "quote_original",
        "quote_cs",
        "context",
        "source_name",
        "source_url"
      ],
      "additionalProperties": false,
      "properties": {
        "speaker": {
          "type": "string"
        },
        "role": {
          "type": "string",
          "description": "trenér, spoluhráč, komentátor, psycholog…"
        },
        "quote_original": {
          "type": "string",
          "description": "Doslovné znění v původním jazyce"
        },
        "quote_cs": {
          "type": "string",
          "description": "Český překlad"
        },
        "context": {
          "type": "string",
          "description": "Kdy a kde to řekl"
        },
        "source_name": {
          "type": "string"
        },
        "source_url": {
          "type": "string",
          "format": "uri"
        },
        "date": {
          "type": "string",
          "description": "Datum výroku, pokud známé"
        }
      }
    }
  }
}
