{
  "id": "2017-masters-garcia",
  "sport": "golf",
  "date": "2017-04-09",
  "event": "Masters Tournament 2017, Augusta National",
  "stage": "finálové kolo a rozstřel",
  "protagonist": "Sergio García",
  "opponent": "Justin Rose",
  "deficit": "73 odehraných majorů bez titulu a pověst hráče, který se mentálně složí, když je pod tlakem. V nedělním kole ztratil vedení po zaváhání na 10. a 11. jamce a propadl se za Rose.",
  "result": "Vítězství v náhlé smrti na 18. jamce birdie ránou — první major po 74 startech, ve věku 37 let",
  "turning_point": "Po ztrátě na 10. a 11. jamce se poprvé v kariéře nepropadl. Na 13. jamce zahrál z borovic parazachraňující ránu, srovnal a dotáhl to do rozstřelu.",
  "mental_mechanism": [
    "prerámování",
    "oddělení od výsledku",
    "přijetí prohry",
    "vnější motiv"
  ],
  "story": "García byl roky symbolem mentální křehkosti v golfu — hráč, který má hru na major, ale ne hlavu. Ve finálovém kole Masters 2017 ztratil vedení přesně tak, jak to dělal vždycky. Rozdíl byl v tom, co následovalo: místo kolapsu přišel klid. Sám popsal, že poprvé přijal dobré i špatné rány a šel dál, a že to byla ta nejklidnější nedělní hra majoru, jakou zažil. Na tiskovce po vítězství byl přímo tázán, na co je nejvíc hrdý — odpověděl, že na ukázku charakteru a mentality, ne na golf.",
  "evidence": {
    "asked_about": true,
    "athlete_quotes": [
      {
        "speaker": "Sergio García",
        "quote_original": "definitely demonstration of my character, and my mentality",
        "quote_cs": "rozhodně ukázka mého charakteru a mojí mentality",
        "context": "Vítězná tiskovka po skončení turnaje, v přímé odpovědi na otázku, na co je nejvíc hrdý.",
        "source_name": "Golf Digest — What it took for Sergio Garcia to finally win a major",
        "source_url": "https://www.golfdigest.com/story/masters-2017-what-it-took-for-sergio-garcia-to-finally-win-a-major",
        "date": "2017-04-09"
      },
      {
        "speaker": "Sergio García",
        "quote_original": "I was able to deal with the emotions the whole week, and accept the good things and the bad things and move on and keep going.",
        "quote_cs": "Celý týden jsem zvládal emoce, přijímal dobré i špatné věci, šel dál a pokračoval.",
        "context": "Vítězná tiskovka po turnaji.",
        "source_name": "Golf Digest",
        "source_url": "https://www.golfdigest.com/story/masters-2017-what-it-took-for-sergio-garcia-to-finally-win-a-major",
        "date": "2017-04-09"
      },
      {
        "speaker": "Sergio García",
        "quote_original": "I think the problem was, because where my head was at sometimes, I did think about if I was ever going to win one.",
        "quote_cs": "Myslím, že problém byl v tom, kde jsem to měl v hlavě — občas jsem opravdu přemýšlel, jestli vůbec někdy nějaký vyhraju.",
        "context": "Vítězná tiskovka, o svém dřívějším rozpoložení.",
        "source_name": "Washington Post",
        "source_url": "https://www.washingtonpost.com/sports/sergio-garcia-completes-his-transformation-by-winning-the-masters/2017/04/09/8a3f3ae4-1d5c-11e7-be2a-3a1fb24d4671_story.html",
        "date": "2017-04-09"
      },
      {
        "speaker": "Sergio García",
        "quote_original": "Probably it's because my mentality has changed a little bit, the way I'm thinking things.",
        "quote_cs": "Nejspíš je to tím, že se moje mentalita trochu změnila — způsob, jakým věci vnímám.",
        "context": "O tom, proč se výsledky změnily.",
        "source_name": "Sky Sports Golf",
        "source_url": "https://www.skysports.com/golf/news/24512/10832395/sergio-garcias-improved-mental-strength-inspired-masters-victory",
        "date": "2017-04-10"
      }
    ]
  },
  "video": [
    {
      "label": "Rozhovor s vítězem o dramatickém závěru",
      "url": "https://www.youtube.com/watch?v=edHh2X8NciY",
      "type": "interview"
    },
    {
      "label": "Kompletní finálové kolo a rozstřel (celý přenos)",
      "url": "https://www.youtube.com/watch?v=kfMSpgr1L3Q",
      "type": "full_match"
    },
    {
      "label": "Garcíovo finálové kolo ve třech minutách",
      "url": "https://www.youtube.com/watch?v=tX6qpK07894",
      "type": "highlights"
    },
    {
      "label": "Vítězný rozstřel na 18. jamce",
      "url": "https://www.youtube.com/watch?v=MVX4XWAg7bU",
      "type": "key_moment"
    }
  ],
  "sources": [
    {
      "name": "Washington Post — Garcia completes his transformation",
      "url": "https://www.washingtonpost.com/sports/sergio-garcia-completes-his-transformation-by-winning-the-masters/2017/04/09/8a3f3ae4-1d5c-11e7-be2a-3a1fb24d4671_story.html"
    },
    {
      "name": "Golf Digest — What it took",
      "url": "https://www.golfdigest.com/story/masters-2017-what-it-took-for-sergio-garcia-to-finally-win-a-major"
    },
    {
      "name": "Sky Sports — improved mental strength",
      "url": "https://www.skysports.com/golf/news/24512/10832395/sergio-garcias-improved-mental-strength-inspired-masters-victory"
    }
  ],
  "verified_at": "2026-09-10",
  "concept": {
    "hook": "74 majorů. Pokaždé, když byl blízko, se složil.",
    "logline": "Nezměnil švih. Změnil to, co dělá po špatné ráně.",
    "duration_s": 52,
    "beats": [
      {
        "t": "0:00–0:04",
        "beat": "Konec",
        "visual": "Archivní záběry Garcíových dřívějších kolapsů, frustrovaná gesta.",
        "overlay": "73 majorů. Pokaždé se složil."
      },
      {
        "t": "0:04–0:14",
        "beat": "Kontext",
        "visual": "Nedělní kolo v Augustě, zaváhání na 10. a 11. jamce, ztráta vedení.",
        "overlay": "A začíná to znovu."
      },
      {
        "t": "0:14–0:24",
        "beat": "Zlom",
        "visual": "Detail na jeho obličej po špatné ráně — klid místo vzteku. Rána z borovic na 13. jamce.",
        "overlay": "Tentokrát žádný propad."
      },
      {
        "t": "0:24–0:36",
        "beat": "Obrat",
        "visual": "Rozstřel na 18. jamce, vítězný birdie putt, pád na kolena.",
        "overlay": "První major v 37 letech."
      },
      {
        "t": "0:36–0:49",
        "beat": "Důkaz",
        "visual": "Záznam z tiskovky — otázka „na co jsi nejvíc hrdý“ a jeho odpověď, s titulky.",
        "overlay": "„Ukázka mého charakteru a mojí mentality.“"
      },
      {
        "t": "0:49–0:52",
        "beat": "Pointa",
        "visual": "Černá plocha, bílý text.",
        "overlay": "Nezměnil švih. Změnil to, co dělá po špatné ráně."
      }
    ],
    "payoff": {
      "speaker": "Sergio García",
      "line": "Rozhodně ukázka mého charakteru a mojí mentality."
    },
    "caption": "74 startů na majorech. Pokaždé, když byl blízko, se složil. Sám o sobě říkal, že občas přemýšlel, jestli vůbec někdy nějaký vyhraje.\n\nV neděli v Augustě ztratil vedení přesně tak jako vždycky — po dvou špatných jamkách.\n\nRozdíl byl v tom, co přišlo potom. Nic. Žádný propad.\n\n„Celý týden jsem zvládal emoce, přijímal dobré i špatné věci, šel dál a pokračoval.“\n\nVyhrál v rozstřelu. A když se ho na tiskovce ptali, na co je nejvíc hrdý, nemluvil o golfu:\n\n„Rozhodně na ukázku mého charakteru a mojí mentality.“\n\nNezměnil švih. Změnil to, co dělá po špatné ráně.\n\nZdroje\n— Finálové kolo a rozstřel: Masters Tournament (Augusta National Golf Club)\n— Rozhovor s vítězem: Masters Tournament\n— Citace: vítězná tisková konference, 9. 4. 2017 (Golf Digest, Washington Post, Sky Sports)",
    "hashtags": [
      "#sergiogarcia",
      "#masters",
      "#golf",
      "#augusta",
      "#mentalnitrenink",
      "#sportovnipsychologie",
      "#mindset",
      "#hlavarozhoduje"
    ],
    "audio": "Tlumená hudba. Golf má ticho jako součást atmosféry — nepřehlušit ho.",
    "closing": "Nezměnil švih. Změnil to, co dělá po špatné ráně.",
    "credits": {
      "on_screen": "Záběry: Masters Tournament / Augusta National",
      "caption_block": "Zdroje\n— Finálové kolo a rozstřel: Masters Tournament (Augusta National Golf Club)\n— Rozhovor s vítězem: Masters Tournament\n— Citace: vítězná tisková konference, 9. 4. 2017 (Golf Digest, Washington Post, Sky Sports)",
      "clips": [
        {
          "use": "Beat 1–4 — dřívější kolapsy, nedělní kolo, rozstřel",
          "rights_holder": "Augusta National Golf Club / Masters Tournament",
          "licence": "all_rights_reserved",
          "url": "https://www.youtube.com/watch?v=kfMSpgr1L3Q"
        },
        {
          "use": "Beat 5 — tisková konference",
          "rights_holder": "Augusta National Golf Club / Masters Tournament",
          "licence": "all_rights_reserved",
          "url": "https://www.youtube.com/watch?v=edHh2X8NciY"
        }
      ],
      "risk": "high",
      "risk_note": "Augusta National hlídá svou značku i záběry mimořádně přísně a nároky uplatňuje i na krátké úryvky."
    },
    "title_card": {
      "eyebrow": "MASTERS 2017 · FINÁLOVÉ KOLO",
      "headline": "74 startů na majoru. Ani jeden titul.",
      "subline": "A pověst hráče, co se pod tlakem složí.",
      "basis": "fakt",
      "basis_note": "Počet startů je doložený. Pověst mentálně křehkého hráče popisuje dobový tisk i sám García na tiskovce."
    }
  }
}
